{
  "$schema": "./schema.json",
  "visibility": {
    "home": true,
    "about": true,
    "experience": true,
    "projects": true,
    "skills": true,
    "education": true,
    "certifications": true,
    "contact": true
  },
  "name": "Yashwant Das",
  "subtitle": "QA Architect • AI-Assisted Test Systems",
  "avatar": "assets/avatars/avatar.webp",
  "resume": "",
  "heroSummary": "Quality Engineering leader with 12+ years of experience building scalable automation systems across OTT streaming, e-commerce, fintech, and enterprise platforms. Currently focused on AI-assisted QA workflows, autonomous testing concepts, and maintainability-first automation architecture.",
  "heroStats": [
    {
      "value": "12+",
      "label": "years in quality engineering",
      "disabled": false
    },
    {
      "value": "Fortune 500",
      "label": "client experience",
      "disabled": false
    },
    {
      "value": "AI + OTT + Fintech",
      "label": "specialized domains",
      "disabled": false
    }
  ],
  "about": "I specialize in Quality Engineering, automation architecture, and AI-assisted testing systems with experience across OTT streaming, e-commerce, fintech, and enterprise platforms. Over the past 12+ years, I’ve led automation initiatives for Fortune 500 clients, built scalable UI/API/mobile automation frameworks, and driven quality strategy across web, mobile, cloud, and media ecosystems.\n\nMy current focus is exploring LLM-assisted QA systems, autonomous test workflows, multimodal validation approaches, and maintainability-focused automation engineering.",
  "experience": [
    {
      "role": "QA Manager",
      "company": "Publicis Sapient",
      "period": "03/2025 — 06/2025 · Bengaluru, India",
      "logo": "assets/logos/publicis-sapient.webp",
      "highlights": [
        "Led Quality Engineering initiatives across web, mobile, and API platforms with hands-on Playwright automation and release validation.",
        "Drove shift-left testing practices by integrating early automation and quality validation into sprint workflows.",
        "Collaborated with engineering and DevOps teams to embed automated quality checks into CI/CD pipelines."
      ],
      "disabled": false
    },
    {
      "role": "Senior Specialist Quality Engineering",
      "company": "LTIMindtree",
      "period": "04/2021 — 06/2024 · Bengaluru, India",
      "logo": "assets/logos/ltimindtree.webp",
      "highlights": [
        "Led automation architecture initiatives across web, mobile, API, and OTT platforms for Fortune 500 clients.",
        "Built scalable automation tooling and Media QC workflows for OTT streaming validation and playback diagnostics.",
        "Mentored QA teams and modernized automation approaches to improve resiliency, maintainability, and delivery efficiency."
      ],
      "disabled": false
    },
    {
      "role": "QA Lead",
      "company": "Future Focus Infotech",
      "period": "07/2019 — 04/2021 · Bengaluru, India",
      "logo": "assets/logos/future-focus.webp",
      "highlights": [
        "Led Quality Engineering for high-traffic mobile and backend platforms across Android and iOS ecosystems.",
        "Designed cross-platform automation frameworks using Appium and Cucumber integrated into CI/CD workflows.",
        "Managed distributed QA collaboration across multiple LATAM regions supporting large-scale retail platforms."
      ],
      "disabled": false
    },
    {
      "role": "Senior QA Engineer",
      "company": "Diagnal Technologies",
      "period": "07/2017 — 07/2019 · Trivandrum, India",
      "logo": "assets/logos/diagnal.webp",
      "highlights": [
        "Led OTT and VOD quality engineering across Smart TVs, Xbox, Fire TV, and mobile platforms.",
        "Validated DRM compliance, streaming protocols, playback quality, and regional content availability.",
        "Integrated automation, analytics, and monitoring workflows to improve streaming diagnostics and release confidence."
      ],
      "disabled": false
    },
    {
      "role": "Associate Engineer",
      "company": "Samsung India Electronics",
      "period": "10/2010 — 07/2012 · Noida, India",
      "logo": "assets/logos/samsung.webp",
      "highlights": [
        "Automated Android platform validation using CTS frameworks to ensure device stability and OS compliance.",
        "Led DRM compliance and media playback validation for Samsung Media Services and Media Hub.",
        "Developed automation workflows improving test coverage and defect detection for mobile platforms."
      ],
      "disabled": false
    }
  ],
  "projects": [
    {
      "title": "Autonomous Test Repair System",
      "description": "LLM-assisted self-healing automation system for Playwright that detects failures, understands UI context from screenshots, and repairs flaky tests using deterministic heuristics and explainable reasoning workflows.",
      "tags": [
        "Playwright",
        "LLMs",
        "Python",
        "AI-Assisted QA",
        "Vision Automation",
        "Automation Architecture"
      ],
      "live": "",
      "code": "https://github.com/yashwant-das/autonomous-test-repair-system",
      "featured": true,
      "disabled": false
    },
    {
      "title": "Smart Playwright Protocol",
      "description": "Agentic Playwright automation framework enabling structured QA workflows, MCP-oriented orchestration, and collaborative human–AI automation systems.",
      "tags": [
        "Playwright",
        "Agentic Workflows",
        "MCP",
        "TypeScript",
        "AI Automation",
        "QA Engineering"
      ],
      "live": "",
      "code": "https://github.com/yashwant-das/smart-playwright-agent-protocol",
      "disabled": false
    }
  ],
  "skills": {
    "AI-Assisted QA": [
      {
        "name": "LLM-Assisted Testing",
        "disabled": false
      },
      {
        "name": "Prompt Engineering",
        "disabled": false
      },
      {
        "name": "Reasoning Pipelines",
        "disabled": false
      },
      {
        "name": "Vision-Based Validation",
        "disabled": false
      },
      {
        "name": "Autonomous Test Workflows",
        "disabled": false
      }
    ],
    "Test Automation": [
      {
        "name": "Playwright",
        "disabled": false
      },
      {
        "name": "Selenium",
        "disabled": false
      },
      {
        "name": "Appium",
        "disabled": false
      },
      {
        "name": "Cypress",
        "disabled": false
      },
      {
        "name": "REST Assured",
        "disabled": false
      },
      {
        "name": "Postman",
        "disabled": false
      },
      {
        "name": "GraphQL Testing",
        "disabled": false
      }
    ],
    "CI/CD & DevOps": [
      {
        "name": "Jenkins",
        "disabled": false
      },
      {
        "name": "GitHub Actions",
        "disabled": false
      },
      {
        "name": "Docker",
        "disabled": false
      },
      {
        "name": "BrowserStack",
        "disabled": false
      },
      {
        "name": "AWS Device Farm",
        "disabled": false
      },
      {
        "name": "Azure DevOps",
        "disabled": false
      }
    ],
    "OTT & Media QA": [
      {
        "name": "DRM Validation",
        "disabled": false
      },
      {
        "name": "HLS / DASH",
        "disabled": false
      },
      {
        "name": "FFmpeg",
        "disabled": false
      },
      {
        "name": "AWS Elemental",
        "disabled": false
      },
      {
        "name": "Playback Analytics",
        "disabled": false
      },
      {
        "name": "Media QC Automation",
        "disabled": false
      }
    ],
    "Programming": [
      {
        "name": "Java",
        "disabled": false
      },
      {
        "name": "Python",
        "disabled": false
      },
      {
        "name": "TypeScript",
        "disabled": false
      },
      {
        "name": "JavaScript",
        "disabled": false
      },
      {
        "name": "SQL",
        "disabled": false
      }
    ],
    "Quality Engineering": [
      {
        "name": "Test Strategy",
        "disabled": false
      },
      {
        "name": "Automation Architecture",
        "disabled": false
      },
      {
        "name": "Agile QA",
        "disabled": false
      },
      {
        "name": "Jira Automation",
        "disabled": false
      },
      {
        "name": "Cross-Platform Validation",
        "disabled": false
      }
    ]
  },
  "education": [
    {
      "degree": "Diploma in Electronics & Embedded Systems",
      "school": "Nettur Technical Training Foundation (NTTF)",
      "period": "2006 — 2009 · Bengaluru, India",
      "disabled": true
    }
  ],
  "certifications": [
    {
      "name": "Generative AI: Prompt Engineering",
      "organization": "IBM",
      "logo": "assets/logos/ibm.svg",
      "disabled": false
    },
    {
      "name": "Introduction to Artificial Intelligence (AI)",
      "organization": "IBM",
      "logo": "assets/logos/ibm.svg",
      "disabled": false
    },
    {
      "name": "Python Essentials 1",
      "organization": "Cisco Networking Academy",
      "logo": "assets/logos/cisco.webp",
      "disabled": false
    },
    {
      "name": "Agile with Atlassian Jira",
      "organization": "Atlassian",
      "logo": "assets/logos/atlassian.webp",
      "disabled": false
    }
  ],
  "contact": {
    "socials": {
      "Email": "mailto:yashworks@gmail.com",
      "LinkedIn": "https://linkedin.com/in/yashwant-das",
      "GitHub": "https://github.com/yashwant-das",
      "Medium": "https://medium.com/@yashwant-das"
    }
  }
}
